{"assessment_observed_at":"2026-08-11T08:00:00+08:00","available_content_bytes":25600,"content_reduction_basis_points":8000,"drift_assessment_sha256":"b3e3d2d0199435353f93c43da0cfd63cc6854b71e8f372d726668c66cf28a862","layer_bindings_sha256":"fc4a8c1cd54a7120d28b2d4795e5b37852cf5af692aeb3ba7c6d1ee806f8bcdf","layer_plan_authorization_ref":"authorization.m4-04.benchmark","layer_plan_sha256":"a2c2b5f11a60edbba834e071132afe3c3cce77ad0a4a34d08d39bd64696f8bbf","layers":[{"content_bytes":1024,"layer":"S0","loaded":true,"skill_count":1},{"content_bytes":4096,"layer":"S1","loaded":false,"skill_count":1},{"content_bytes":4096,"layer":"S2","loaded":true,"skill_count":1},{"content_bytes":16384,"layer":"S3","loaded":false,"skill_count":1}],"loaded_at":"2026-08-11T08:00:00+08:00","loaded_content_bytes":5120,"loader_version":"context.layered-skill-loader/v1alpha1","omitted_content_bytes":20480,"packet_sha256":"40322890a4ac0c8d2eef3344d6bc241ffcc1ecc618b5cd012df1d3cedbc1e67a","requested_layers":["S0","S2"],"schema_version":"context.layered-skill-load/v1alpha1","skills":[{"content_bytes":1024,"content_sha256":"0c66f2c45405de575189209a768399bcaf88ccc51002407e395c0136aad2844d","layer":"S0","loaded":true,"skill_id":"core.bootstrap"},{"content_bytes":4096,"content_sha256":"13baaad085152f5bd8c0691f5b959fb47959ec5ef2d4d7ea89519ba28d4a02dd","layer":"S1","loaded":false,"skill_id":"core.manifest"},{"content_bytes":4096,"content_sha256":"c93eee2d0db02f10acc7460d9576e122dcf8cd53c4bf8dfcae1b3e74ebcfff5a","layer":"S2","loaded":true,"skill_id":"project.active"},{"content_bytes":16384,"content_sha256":"23a92a391c7e2d8244524cee85b0aa559034e7adb2bd7396c99adc5ad0040b90","layer":"S3","loaded":false,"skill_id":"external.reference"}]}
